	Date	Type	ID	Title	Location1	Location2	Description	Area	Bedrooms	Legal	WC	House orientation	Furniture	Price
114	14/11/2023	Tin Thường	113918	Bán nhà 3 lầu 4x20m mặt tiền đường NB Cao Lỗ Phường 4 Quận 8	Quận 8 , Hồ Chí Minh	Mức giá	Bán nhà 3 lầu mặt tiền đường NB Cao Lỗ Phường 4 Quận 8 + Diện tích: 4 x 20m – DTSD: 202.7m2 + Hiện trạng: Nhà xây dựng kiên cố 1 trệt, 3 lầu, sân thượng trước + sau, 4PN, 3WC, phòng thờ, bếp,… đầy đủ tiện nghi. + Vị trí: Mặt tiền đường 10m, sát bệnh viện Quận 8, trường ĐH Công Nghệ SG, thông ra đường Phạm Thế Hiển, xe cộ dễ dàng lưu thông qua các quận lân cận. + Tiện ích: Dân cư hiện hữu, nhà cao tầng đồng bộ, xung quanh nơi ở đầy đủ các nhu cầu thiết yếu, thích hợp sinh sống và kinh doanh phát triển đa ngành. + Hướng Tây Bắc + Sổ hồng hoàn công + Giá: 10.8 Tỷ (T/L) Liên hệ: 0933 862 860 Ms Sương Tư vấn pháp lý & xem nhà miễn phí Hỗ trợ vay ngân hàng 80% giá trị nhà Nhận ký gửi cho thuê nhà đất các Quận TP.HCM	80	nan	nan	nan	nan	nan	10 tỷ 800 triệu
115	20/10/2023	Tin Thường	111614	Nhà đẹp ở ngay, 4 tầng , tặng nội thất cao cấp Nguyễn Thiện Thuật,quận Bình Thạnh nhỉnh 3 tỷ	Bình Thạnh , Hồ Chí Minh	Nguyễn Thiện Thuật, Bình Thạnh	Nhà đẹp ở ngay, 4 tầng , tặng nội thất cao cấp Nguyễn Thiện Thuật,quận Bình Thạnh nhỉnh 3 tỷ - Đầy đủ công năng.Nhà chính chủ, sổ công nhận đủ, hoàn công đầy đủ, sổ để trong tủ, công chứng mua bán trong ngày nếu khách chốt giá xuống cọc. - Gần chợ bà Chiểu,trường mầm non, trường học các cấp,đại học, qua các quận trung tâm 1, 3 chỉ mất vài phút xe máy, con đường ẩm thực Bùi Đình Túy, Vạn Kiếp,các dịch vụ tiện ích khác đầy đủ,gần phường,ủy ban,kho bạc,ngân hàng. - Call hoặc Zalo 0914.171.315, Mesenger : ĐỂ ĐƯỢC HỖ TRỢ TƯ VẤN NHANH NHẤT - Tư Vấn Miễn Phí Tìm Mua Nhà Theo Nhu Cầu Khu Vực Bình Thạnh,Phú Nhuận, Gò Vấp	70	nan	nan	nan	nan	nan	3 tỷ 950 triệu
116	17/06/2023	Tin Thường	99583	BÁN NHÀ HẺM XE HƠI NGUYỄN THÁI SƠN, GÒ VẤP, 75M2, 6TY9 THƯƠNG LƯỢNG.	Gò Vấp , Hồ Chí Minh	Gò Vấp, Thành phố Hồ Chí Minh	BÁN NHÀ HẺM XE HƠI NGUYỄN THÁI SƠN, GÒ VẤP, 75M2, 6TY9 THƯƠNG LƯỢNG. ++ Ngang 4,5m dài 17m ++ sổ đẹp LH Hương xem nhà ngay	75	nan	nan	nan	nan	nan	6 tỷ 900 triệu
0	26/11/2023	Tin Thường	113141	CMT8 Sát CLB Lan Anh P12 Q10, 60m2 cách MT đường 30m, Chỉ 3.59 tỷ	Quận 10 , Hồ Chí Minh	Mức giá	Nhanh kịp sở hữu ngay căn nhà vị trí cực Vip giảm sâu hơn 1 tỷ còn nhỉnh 3 tỷ. ????️MẶT TIỀN TƯƠNG LAI CMT8 Q10 - ĐANG CHO THUÊ 10TR/THÁNG. + Diện tích: 30m2 công nhận đủ (4 x 7.5m) + Kết cấu: 2 tầng gồm trệt 1 lầu, 2 PN. - Vị trí cực đẹp, vài bước ra mặt tiền. Vài bước chân ra CLB Lan Anh, vòng xoay Dân Chủ, sát Q3, gần Hà Đô - Đang cho thuê nhiều năm nay với giá 10tr/tháng. - Sổ tại nhà, mua bán nhanh lẹ. ???? Giảm sâu 1.8 tỷ còn 3.59 tỷ LH Ng Hương 0938509958 ngay khi ace nhận được tin kịp sở hữu ngay căn nhà vị trí tiềm năng này nhé ạ	60	2	nan	2	nan	nan	3 tỷ 590 triệu
1	14/01/2023	Tin Thường	88566	Nhà mặt tiền Đường số 6 Phường 15 Gò Vấp, 48m2, 3 tầng, chỉ 6 tỷ	Gò Vấp , Hồ Chí Minh	Đường Số 6	MS 723 * Vị trí: mặt tiền Đường Số 6, Phường 15, Gò Vấp. Gần trục đường chính Lê Đức Thọ, trường Mầm non, Tiểu học, rất nhiều tiện ích xung quanh. * Diện tích 48m2, 3 tầng BTCT. Thiết kế 1 trệt, 2 lầu, với 4 phòng ngủ, 3 toilet. * Đường trước nhà tráng nhựa, xe hơi tránh. * Hình sổ vuông đẹp.	48	4	nan	3	nan	nan	6 tỷ
2	05/06/2023	Tin Thường	98550	Gấp bán nhà đường Điện Biên Phủ Bình Thạnh P22. HXh quay đầu giá chỉ 4 tỷ 4 TL.	Bình Thạnh , Hồ Chí Minh	Điện Biên Phủ	3 tầng BTCT, sổ vuông vứt, ngang 3.8x 10. 3 PN trong đó có 2 PN master, thiết kế được thêm 1 PN nữa. Otô đổ cửa, vài bước ra hẻm 10m để được 4 xe hơi 7m thoái mái. Sát mặt tiền,tiện kinh doanh đa ngành nghề. Khu toàn nhà cao tầng hiện đại, dân trí cao, toàn cán bộ cấp cao ở xung quanh. Cách Quận 1 năm phút, thông xô viết nghệ tĩnh, nguyễn hữu cảnh, cầu Sài Gòn chỉ mấy mét. Gần các trường đại học lớn như: đại học Hồng Bàng, đại học kinh tế tài chính, đại học công nghệ. Sổ sách chuẩn, công chứng ngay.	38	3	nan	3	nan	nan	4 tỷ 400 triệu
3	01/06/2023	Tin Thường	98294	Cho thuê nhà nguyên căn 1 trệt 1 gác 75m2 2PN giá chỉ 5tr/tháng ở ngay, Lh: 0388668882 gặp Tâm ( zalo )	Quận 9 , Hồ Chí Minh	Đường 475 Phường Phước Long B, Q9	Nhà cho thuê nguyên căn - Hẻm đường 475 p. Phước long B quận 9 - Diện tích sử dụng : 75m - Thiết kế : Trệt lửng ( có thể ngăn 2PN ) - Giá cho thuê : 5 triệu ( cọc 1 tháng ) - Nhận nhà ở liền ☎️ 0388668882 gặp Tâm ( zalo )	75	2	nan	1	nan	nan	5 triệu/tháng
4	11/04/2023	Tin Thường	94454	BÁN GẤP NHÀ TÂN PHÚ ĐƯỜNG LŨY BÁN BÍCH 57M2 HẺM XE HƠI CHỈ VỚI 5.95 TỶ.	Tân Phú , Hồ Chí Minh	LŨY BÁN BÍCH TÂN PHÚ	+ Vị trí ngay Chợ vải Phú Thọ Hoà, 500M ra Luỹ Bán Bích, gần UBND Quận… + Kết cấu: Trệt, 2 Lầu, sân thượng, 3PN, 3WC, Phòng thờ, giếng trời thoáng mát. + Diện tích 57M2, ngang 4.3M, dài 13M hậu nhẹ. + Hẻm xe hơi, xác mặt tiền, hàng xóm thân thiện. + Sổ vuông vức, pháp lý chuẩn, công chứng trong ngày.	57	3	nan	3	Đông-Nam	nan	5 tỷ 950 triệu
5	09/01/2023	Tin Thường	88310	Bán Ngay Căn Hộ Cao Cấp Decapella Siêu Đẹp Ngay TT Q2	Quận 2 , Hồ Chí Minh	116	"Căn hộ De Capella Thủ Thiêm nằm mặt tiền Lương Đình Của, P. Bình Khánh, Quận 2. Căn hộ hoàn thiện cao cấp, nhà mới 100%, nhà có sẵn tiện bàn giao ngay. - Bàn giao hoàn thiện: Tủ bếp, Bếp điện + máy hút Malloca, Tủ âm tường, thiết bị vệ sinh, Sàn gỗ... - Sổ hồng sở hữu lâu dài. - De Capella liền kề Khu Sala, qua Cầu Thủ Thiêm 2, Thảo Điền... - Hầm Thủ Thiêm ra quận 1 chỉ 5 phút. - Cạnh BV quốc tế Mỹ, chợ Đo Đạc, chợ Bình Khánh, Trường quốc tế Tuệ Đức, Trường Nguyễn Hiền, Metro, Vinmart... - Tiện ích nội khu: Đường đi bộ canh xanh quanh dự án, Hồ bơi, Kidsroom, Gym - Spa, shophouse... - Tiện ích ngoại khu đầy đủ trong bán kính 5km: Vincom, BigC, Nhà hàng - Cafe, hệ thống ngân hàng, trường học... - Giá trực tiếp chủ đầu tư: 4,5tỷ/căn -DT từ 56m2-102m2 - Thanh toán theo tiến độ nhẹ nhàng 3%/tháng, không lãi suất 24 tháng. - Chiết khấu khủng lên đến 16% khi thanh toán nhanh, nhận nhà sớm. - Thanh toán 30% nhận nhà, NH hỗ trợ vay 70% (Ân hạn gốc + lãi 12 tháng). Đặc biệt: ""Khách hàng vay - Chủ đầu tư trả lãi"". LH: gặp Bảo. Xin cảm ơn"	56	1	nan	1	nan	nan	4 tỷ 500 triệu
6	08/12/2023	Tin Thường	114933	Bán nhà 2 mặt tiền đường Phạm Văn Đồng, Thủ Đức - 118m2 - full thổ cư - 23,5 tỷ	Thủ Đức , Hồ Chí Minh	Đường Phạm Văn Đồng, Phường Hiệp Bình Chánh, Quận Thủ Đức, TP HCM	Bán nhà 2 mặt tiền đường Phạm Văn Đồng, Thủ Đức - 118m2 - full thổ cư - 23,5 tỷ - Ngân hàng Techcombank. Cho vay đến 17tỷ lãi suất ưu đãi, khách chỉ cần số tiền còn lại. - Bán nhà 2 mặt tiền đường Phạm Văn Đồng và Kha Vạn Cân, Phường Hiệp Bình Chánh, Thủ Đức. - Ví trí đẹp đối diện Trung tâm thương mại GigaMall. - Vị trí khu vực kinh doanh sầm uất, tấp nập. Thích hợp xây cao ốc, văn phòng, khách sạn, showroom hoặc kinh doanh buôn bán ……. - Hiện đang cho thuê 30tr/tháng. - Hướng : Bắc - Nam - Diện tích : 5,9m x 20m, full thổ cư, sổ hồng riêng. - Giá bán: 23,5 tỷ ( thương lượng ) - Hỗ trợ vay Ngân Hàng. Liên Hệ Em Long 0898 408 677 để được xem và mua nhanh nhất!! Mong tiếp khách thiện chí	118	nan	nan	nan	nan	nan	19 tỷ
7	03/01/2023	Tin Thường	88054	CHO THUÊ NHÀ TRUNG TÂM QUẬN 3 GIÁ RẺ	Quận 3 , Hồ Chí Minh	Hẻm 14 Kỳ Đồng, phường 9, quận 3	Chính chủ cho thuê , số điện thoại :0936217143. Nhà khu hẻm 14 kỳ đồng, trung tâm q.3 trống từ 28/2/2023. Chi tiết như sau: 3.4mx10m, 1 trệt 2 lầu tổng diện tích 115m2; 3pn 3wc , bếp , p. khách, máy lạnh máy nước nóng, 5 phút ra tới trung tâm q.1 ;nằm trong Khu dân cư an ninh yên tĩnh. Thích hợp cho người nước ngoài đến làm việc tại tp hcm/gia đình/công chức/,... giá cho thuê :13 triệu/ tháng. Hợp đồng 1 năm trở lên	115	3	nan	3	nan	nan	13 triệu/tháng
8	30/12/2022	Tin Thường	87798	NHÀ CHỈ 1.5 TỶ VỚI 39m2 – NGAY CHỢ BÀ CHIỂU, ĐINH TIÊN HOÀNG, BÌNH THẠNH	Bình Thạnh , Hồ Chí Minh	Mức giá	BT331222 NHÀ CHỈ 1.5 TỶ VỚI 39m2 – NGAY CHỢ BÀ CHIỂU, ĐINH TIÊN HOÀNG, BÌNH THẠNH - Nhà trung tâm Phường 1 Bình Thạnh, 1 cây cầu sang quận 1. - kết cấu trệt 2 PN, 1WC, 1 P.KHÁCH BẾP. - Hẻm xe tải cách 1 căn nhà vài bước chân. - chỉ 1.5 tỷ - Sổ hồng chuẩn hoàn công đủ Xem nhà hãy gọi ngay(Zalo): 0903329000 HUY Chân Thành, Nhiệt Tình. MIỄN PHÍ MỌI DỊCH VỤ	39	nan	nan	nan	nan	nan	1 tỷ 500 triệu
9	23/12/2022	Tin Thường	87286	Gò Vấp, Phạm Văn Chiêu Phường 14, 50m2, 2 tầng chỉ 4 tỷ 400 triệu	Gò Vấp , Hồ Chí Minh	Phạm Văn Chiêu	MS 29522 * Vị trí: đường Phạm Văn Chiêu, Phường 14, Gò Vấp. * Diện tích sử dụng 62 m2, ngang 4m dài 15.5m, 2 tầng. Thiết kế: 1 trệt, 1 lửng gồm 3 phòng ngủ, 2WC. • Hẻm trước nhà 5m, rộng rãi, thoáng mát yên tĩnh. • Pháp lý sạch công chứng ngay. * Phù hợp để ở, mua đầu tư, cho thuê	50	3	nan	2	nan	nan	4 tỷ 400 triệu
10	08/12/2022	Tin Thường	85750	Bán nhà 2 tầng đường số 2, P.Tăng Nhơn Phú B, 88m2, giá rẻ 4.5 tỷ	Quận 9 , Hồ Chí Minh	Mức giá	+ Vị trí : cách đường Lã Xuân Oai 200m, Lê Văn Việt 600m + Diện tích : 88m2 ( 8×11 ), lô góc vuông vức + Kết cấu : 1 trệt, 1 lầu, 3pn, 2wc + Hẻm xe tải tránh nhau + Hẻm thông đường 102, Lã Xuân Oai + Pháp lý chuẩn, sổ hồng riêng, công chứng ngay + Bán gấp giá 4.5 tỷ thương lượng + Liên hệ Duy để xem nhà	88	nan	nan	nan	nan	nan	4 tỷ 500 triệu
11	05/12/2022	Tin Thường	85494	Bán nhà mới đường HÒA BÌNH,TÂN PHÚ - 72m2 - Mặt tiền 4m. Nhỉnh 6 Tỷ	Tân Phú , Hồ Chí Minh	Hòa Bình, Hòa Thạnh, Tân Phú, Hồ Chí Minh	- Diện tích : 4m x 18m = 72m2 - Nhà 1 trệt 1 lầu gồm 3PN, WC, Bếp, phòng khách, sân để xe - Vị trí đẹp, hẻm thông đường KÊNH TÂN HÓA, LŨY BÁN BÍCH, THOẠI NGỌC HẦU,... Cách Đầm Sen vài bước chân. Gần trường học, siêu thị- tiện ích xung quanh đầy đủ - Di chuyển nhanh sang các quận Bình Tân, Tân Bình, Q6, Q11, Q10 - Sổ hồng pháp lý chuẩn, chính chủ công chứng ngay * Liên hệ 0971034978 (Công Thành) để được hỗ trợ xem nhà tốt nhất * Nhận tìm nhà theo nhu cầu Miễn Phí	72	3	nan	nan	nan	nan	6 tỷ 500 triệu
12	19/11/2022	Tin Thường	83702	PHÁ SẢN BÁN GẤP NHÀ NGUYỄN THỊ THẬP - 46M2 2.1 TỶ	Quận 7 , Hồ Chí Minh	Mức giá	Phá sản bán gấp nhà hẻm đường Nguyễn Thị Thập, phường Bình Thuận, quận 7 DT: 46m2 (ngang 4m, dài 11.5m) Nhà gồm 2 phòng ngủ, 2 toilet, phòng khách, bếp Khu vực nhà gần: trạm xăng, ngân hàng, nhà thuốc, Go NTT,… Hẻm rộng, sạch sẽ Khu dân cư đông đúc, dân trí Sổ hồng riêng, chính chủ, sang tên công chứng trong ngày Giá: 2.1 tỷ	46	2	nan	2	nan	nan	2 tỷ 100 triệu
13	10/11/2022	Tin Thường	82678	Sở hữu ngay Căn hộ thông minh tại Phú Mỹ Hưng chỉ từ 2 tỉ	Quận 7 , Hồ Chí Minh	23 Đường Phú Thuận, P. Tân Phú, Quận 7	✨ SUNSHINE SKY CITY ✨ ***** Giá 86 Triệu/M2 ***** + Vị trí kim cương đắc địa: - Mặt tiền đường Phú Thuận, bên dòng sông Cả Cấm, liền kề Phú Mỹ Hưng. - 2 siêu trung tâm thương mại, 3 Bệnh viện Quốc tế, 12 Trường Quốc tế, hơn 200 Spa, hơn 500 nhà hàng… trong bán kính 1.5 km. - 18 phút đến Quận 1; 15 phút đến Quận 2 + Tiện ích không giới hạn: - Dịch vụ đưa đón bằng xe sang với ứng dụng Udee - Trải nghiệm thượng lưu (CLB Cigar & Rượu vang, nhà hàng chân mây sang trọng). - Chăm sóc sức khoẻ (Gym & Yoga, Spa, bể bơi vô cực) - Giáo dục chuẩn Quốc tế (Thư viện, Maple Bear School) - Hệ sinh thái xanh (12,000 m2 mặt nước cảnh quan, không gian xanh rộng khắp) - Đường dạo bộ trên không - Sông nội khu liên tòa + Vận hành tiêu chuẩn 5* bởi Matterhorn và các thương hiệu vận hành quốc tế + Thiết kế tối ưu, căn hộ 4.0 hiện đại: - Diện tích căn hộ đa dạng, trần cao thông thoáng + 2PN: 76-78m2 + 3PN: 100-112m2 + Penthouse Duplex: 155-235m2 - 100% căn hộ bắt trọn ánh sáng theo phương ngang - Kính Low-E hiện đại cách nhiệt và tiếng ồn - Bàn giao nội thất nhập khẩu Châu u: Hafele, Duravit, Hansgrohe… - Ứng dụng công nghệ Smart-living 4.0 vào từng căn hộ và công tác quản lý, vận hành toàn dự án ⭐ PHÁP LÝ ĐẦY ĐỦ - MINH BẠCH: thanh toán đợt 1 (15%) ký ngay HĐMB ⭐ Hỗ trợ vay tối đa 70% với lãi suất ưu đãi và ÂN HẠN GỐC LÃI 18 tháng kể từ ngày ký HĐMB⭐ ⭐ Chiết khấu ngay 3% khi đặt cọc trên giá trị hợp đồng và LÊN ĐẾN 15% - tặng kèm sổ tiết kiệm 150 triệu	77	2	nan	2	nan	nan	7 tỷ 080 triệu
14	03/11/2022	Tin Thường	81654	Cho thuê gấp căn hộ Flora Fuji, 55m2 1+1PN , Full nội thất, nhận nhà ở ngay, giá chỉ 7tr bao phí quản lý	Quận 9 , Hồ Chí Minh	Đường Đỗ Xuân Hợp, Phường Phước Long B, Q9	Cho thuê căn hộ Flora Fuji Diện tích: 55m2 1+1PN - 1WC Nội thất: Full nội thất Tiện ích: Hồ Bơi, gym, khu vui chơi, đường chạy bộ, siêu thị............... Nhận nhà ở ngay - GIÁ THUÊ: 7tr /THÁNG bao gồm phí quản lý Nhận nhà ở ngay Địa chỉ: Đường Đỗ Xuân Hợp, Phường Phước Long B, Q9 LH: 0388668882 Gặp Tâm ( zalo ) xem nhà Nhận ký gửi bđs Q9	55	1	nan	1	nan	nan	7 triệu/tháng
15	01/11/2022	Tin Thường	81142	Nhà đẹp, kiên cố, Nguyễn Kiệm, 5.1 x 9m, 3 lầu, 5.9 tỷ, Phú Nhuận	Phú Nhuận , Hồ Chí Minh	Nguyễn Kiệm, Phường 9, Quận Phú Nhuận, Hồ Chí Minh	BÁN NHÀ Nguyễn Kiệm, Phường 9, Quận Phú Nhuận. Dt: 5,1 x 9m, trệt 3 lầu Đúc, sân thượng. 3pn, 4wc. - Tặng nội thất cao cấp như hình. Hướng Tây Bắc. Hẻm 3.5m thông, cách mặt tiền Nguyễn Kiệm 150m. Giá bán 5.9 tỷ Thương Lượng nhanh cho người thiện chí. Liên hệ: 0989530347 Hoàng Khang	45	3	nan	4	nan	nan	5 tỷ 900 triệu
16	30/10/2022	Tin Thường	80886	NHÀ BÁN VÀO Ở NGAY - 4 TẦNG BTCT - TÂN KỲ TÂN QUÝ - 47M2 - NHỈNH 5 TỶ.	Tân Phú , Hồ Chí Minh	Mức giá	+ Khu vực cực kỳ an ninh và yên tĩnh ở thì quá tuyệt vời. + Nhà 1 trệt 2 lầu sân thượng trước sau, thiết kế lệch tầng, giếng trời sáng thoáng. + 4PN 1 phòng thờ, mỗi tầng 1 nhà vệ sinh. + Hẻm nhựa sạch đẹp hơn 3m. + Sổ đẹp vuông vức nở hậu nhẹ hoàn công đầy đủ. + Sát bên Tân Bình, Cộng Hòa, Trường Chinh, trường ĐH Công nghiệp thực phẩm, siêu thị Aeon Tân Phú.	47	nan	nan	4	nan	nan	5 tỷ 500 triệu
17	19/06/2023	Tin Thường	99830	⏩ NHÀ ĐẸP 3 TẦNG - LẠC LONG QUÂN 47m2 - 6,4 TỶ	Quận 11 , Hồ Chí Minh	Mức giá	⏩ NHÀ ĐẸP 3 TẦNG - LẠC LONG QUÂN 47m2 - 6,4 TỶ ✅ Vị trí: 351 Lạc Long Quân P5 Q11 ✅ Diện tích: 3m5 x 13m5 ( DTSD: 125m2 ) ✅ Kết cấu: Xây dựng lệch tầng hiện đại. Gồm 3pn, 4wc, 1 phòng thờ, 2 sân thượng, Năng lượng mặt trời. ✅ Sổ vuông vắn xây full không quy hoạch lộ giới. ✅ Hẻm 4m xe hơi đổ cửa thông tứ tung ☎️ Gọi ngay đi xem Nhà Đẹp này 093 888 6128 Thúy Dinh ( 翠莹 ). ⏩ Kết bạn Zalo để xem kho hàng và luôn cập nhật hàng mới nhất --------------------- KHÔNG TIN ẢO - NHÀ THẬT HÌNH THẬT Ms548	50	3	nan	nan	nan	nan	6 tỷ 400 triệu
18	04/07/2023	Tin Thường	101110	Nhà 2 tấm đường 32, Linh Đông, Thủ Đức, 4*12.8, xe hơi đậu trước cửa	Thủ Đức , Hồ Chí Minh	Thủ Đức	Nhà 2 tấm đường 32, Linh Đông, Thủ Đức, 4*12.8, xe hơi đậu trước cửa. Chủ cần bán nhanh giảm giá chào ngày giá chào mới 4 tỷ 2 Tiện ích: + Nhà BTCT chắc chắn, 1 lầu, 1 trệt, phòng khách, bếp, 2 phòng ngủ, 2 wc, sân trước, ô giếng trời phía sau. + Khu dân cư yên tĩnh, an Ninh tốt, hàng xóm thân thiện, sát bên cạnh chung cư 4S Linh Đông, 300m ra Phạm Văn Đồng 1km chợ Hiệp Bình, Gigamail, trường học.... + Nhà mới xây rất mới chỉ việc xách vali vào ở ngay + Sổ hồng chính chủ, hoàn công đầy đủ, sẵn sàng công chứng ngay trong ngày	52	3	nan	3	nan	nan	4 tỷ 200 triệu
19	03/12/2023	Tin Thường	114678	Bán nhà hẻm 4.5m Nguyễn Văn Khối Phường 11 Gò Vấp 55m2 4 tầng chỉ 7 tỷ	Gò Vấp , Hồ Chí Minh	Nguyễn Văn Khối	MS 32023 * Vị trí: gần siêu thị, chợ, trường học các cấp, bệnh viện, công viên Làng Hoa, dịch vụ tiện ích xung quanh bao la. Thuận tiện giao thông. * Hẻm xe hơi ngủ trong nhà, rộng 4.5m, an ninh, sạch sẽ. Dãy nhà cao tầng, dân trí. * Diện tích 55m2, 4 tầng, 4 phòng ngủ, 5WC. * Pháp lý: không lộ giới, sổ hồng hoàn công đầy đủ.	55	4	nan	5	nan	nan	7 tỷ
20	30/12/2022	Tin Thường	87799	Nhà mới ở ngay 3PN, Hẻm 5m, kinh doanh tốt, 43m2, Liên khu 5-6, Bình Tân. Chỉ 3 tỷ 600	Bình Tân , Hồ Chí Minh	Liên khu 5-6	Nhà mới ở ngay 3PN, Hẻm 5m, kinh doanh tốt, 43m2, Liên khu 5-6, Bình Tân. Chỉ 3 tỷ 600 + DT 43m2, dài 14m, sổ công nhận đủ. Nhà 2 tầng với khách, bểp, rộng rãi, ban công và 3 phòng ngủ, WC +Hẻm 5m xe tải đỗ cửa, cách 1 căn tới chợ LK 5-6, phù hợp vừa ở vừa kinh doanh ✅ Ngay trung tâm liên khu 5-6, tiên ích đầy đủ, đi Tân Kỳ Tân Quý, Mã Lò, QL1A chỉ 5 phút, thuận tiện di chuyển sang các quận lân cận như Tân Phú, Hóc Môn, Bình Chánh,... + Pháp lý chuẩn, hoàn công đầy đủ, công chứng nhanh ☎️????Xem nhà miễn phí liên hệ em Mai Hoa SĐT hoặc Zalo 0707461661 để được tư vấn và gặp chủ thương lượng	43	3	nan	nan	nan	nan	3 tỷ 600 triệu
21	16/12/2022	Tin Thường	87543	QUẬN 10 – MT -NGÔ GIA TỰ- HXH-5 TẦNG-50M- SỔ NỞ HẬU CHỦ CẦN BÁN GẤP-GIÁ 9.8 TỶ-THƯƠNG LƯỢNG	Quận 10 , Hồ Chí Minh	Thành phố Hồ Chí Minh	+ Vị trí đẹp, gần ngả 6 Lý Thái Tổ, vòng xoay Nguyễn Tri Phương, khu đồ gỗ nội thất nổi tiếng đường Ngô Gia Tự. + Kết cấu: 1 trệt, 3 lầu, sân thượng, 4 PN, 4WC. + Mặt tiền thụt của con đường bự nhất và đắc giá nhất Quận 10. +++ Tuyến đường trung tâm các Quận, ưu điểm kinh doanh, mua bán, cho thuê VP..tiện ích đầy đủ. +++SỔ NỞ HẬU L NỞ TIỀN ,PHÁP LÝ CHUẨN- CÔNG CHỨNG NHANH LẸ..	50	4	nan	4	nan	nan	9 tỷ 800 triệu
22	18/12/2022	Tin Thường	86775	Nhà HXH, Nam Hòa, PhướcLong A ♥️77 M2♦️,NỞ HẬU, Mới xây, Nội Thất Đẹp, Ở NGAY.	Quận 9 , Hồ Chí Minh	Nam Hòa , Phước Long A, Quận 9, thủ đức	Nhà HXH, Nam Hòa, PhướcLong A ♥️77 M2♦️ NỞ HẬU, Mới xây, Nội Thất Đẹp Ở NGAY. ☎️ Lh 0978584006 Zalo 0852726142 + Ngang lớn , đậu oto trong nhà. + Giao thông thuận tiện ra Đỗ Xuân Hợp, Dương Đình hội. Xa lọi Hà Nội. + 2 Phút ra tuyến Metro trên cao + Gần CĐ CÔNG THƯƠNG, Kinh tế đối ngoại, THCS, TH Phước Long A.	77	4	nan	4	nan	nan	8 tỷ 500 triệu
23	27/11/2022	Tin Thường	84471	Vừa ở vừa kinh doanh - Xe hơi ngủ trong nhà - 36m2 - Chỉ 8.4 tỷ	Quận 10 , Hồ Chí Minh	Tô Hiến Thành, Phường 12, Quận 10, TPHCM	+ Tô Hiến Thành, P.12, Quận 10. + Diện tích: 36m2 (3.6 x 10), nở hậu nhẹ. + Nhà 1 trệt, 1 lầu, 2PN lớn, 2WC. Nhà còn rất mới, chỉ việc xách vali vào ở ngay. + Hẻm xe hơi ngủ trong nhà thoải mái. + Khu trung tâm Quận 10, ngay ngã 4 Tô Hiến Thành - Thành Thái. + Giá: 8.4 tỷ + Liên hệ Mr Nhân 0779988718 (Zalo) xem nhà trực tiếp. *** Hỗ trợ tìm nhà miễn phí theo nhu cầu khách hàng.	36	2	nan	2	Đông-Nam	nan	8 tỷ 400 triệu
24	15/11/2022	Tin Thường	83191	Chỉ 5,6 Tỷ Căn Hộ 2PN Phú Mỹ Hưng Quận 7 Ngân Hàng Cho Vay Đến 70%	Quận 7 , Hồ Chí Minh	Mức giá	Vị trí: Mặt tiền đường Phú Thuận, bên dòng sông Cả Cấm, cách Phú Mỹ Hưng chỉ 300m Chủ đầu tư: Sunshine Group - Quy mô: 42,529 m2 gồm 9 tháp căn hộ S1-S9 cao từ 26 – 38 tầng - Pháp lý: Người Việt Nam Sổ (lâu dài) - Người Nước Ngoài (50 năm) - Thời gian bàn giao: Qúy I/2024 - Hệ thống hơn 50 tiện ích nội khu và thừa hưởng trọn vẹn các tiện ích của Khu Đô Thị Phú Mỹ Hưng trong bán kính chỉ 1km: trường học Quốc tế, siêu thị, bệnh viện quốc tế, trung tâm thương mại sầm uất,... SẢN PHẨM ĐANG MỞ BÁN TÒA S2- GIÁ CHỈ TỪ 5,6 TỶ CĂN ĐÃ BAO GỒM VAT LIÊN HỆ TƯ VẤN XEM NHÀ MẪU: 0903 727 662 em Tiên Loại sản phẩm: Căn hộ, Sky Villa, Văn phòng đa năng + 2PN: 76-78m2 + 3PN: 100-112m2 + Penthouse Duplex: 155-235m2 - Đơn vị quản lý vận hành: Matterhorn - Bàn giao: Smarthome nội thất cơ bản - Pháp lý minh bạch: thanh toán đợt 1 (15%) ký ngay HĐMB - Ngân hàng hỗ trợ: Kiên Long Bank hỗ trợ cho vay 70% ân hạn lãi gốc 18 tháng - Thiết kế hiện đại chuẩn Smarthome thế hệ mới + 100% căn hộ bắt trọn ánh sáng theo phương ngang + Kính Low-E hiện đại cách nhiệt và tiếng ồn + Bàn giao nội thất nhập khẩu Châu Âu: Hafele, Duravit, Hansgrohe… + Ứng dụng công nghệ Smart-living 4.0 vào từng căn hộ và công tác quản lý, vận hành toàn dự án, hệ sinh thái 5 sao Sunshine Group ------------------------- LIÊN HỆ TƯ VẤN XEM NHÀ MẪU: 0903 727 662 em Tiên	77	nan	nan	nan	nan	nan	5 tỷ 500 triệu
25	14/11/2022	Tin Thường	82935	THÔNG TIN MẶT BẰNG TRỐNG HM SQUARE BUILDING	Bình Thạnh , Hồ Chí Minh	24A Phan Đăng Lưu, Phường 6, Quận Bình Thạnh	[Chính chủ cần cho thuê] THÔNG TIN MẶT BẰNG TRỐNG HM SQUARE BUILDING Địa chỉ: 24A Phan Đăng Lưu, Phường 6, Quận Bình Thạnh. Tầng 4: (đang trống) • Diện tích: 105 m2 (mặt trước) • Giá: 13.5 + 4.5 + VAT (có thể thương lượng) • Xe máy: 150.000 VNĐ/tháng – Xe oto: 1.500.000 VNĐ/tháng • Hiện trạng: sàn gỗ, máy lạnh trung tâm, có vách ngăn, đèn chiếu sáng.	105	nan	nan	nan	Nam	nan	75 triệu/tháng
26	05/11/2022	Tin Thường	81911	Nội thất, Trương Quốc Dung, 4.3 x 9.5, 2 lầu, 5.4 tỷ, Phú Nhuận	Phú Nhuận , Hồ Chí Minh	Trương Quốc Dung, Phường 10, Quận Phú Nhuận, Hồ Chí Minh	Nhà bán Trương Quốc Dung, Phường 10, Quận Phú Nhuận. - DT: 4.3 x 9.5m, công nhận đất 40m2. - Thiết kế Trệt + Lửng + 2Lầu. 3pn + 3wc + 2phòng làm việc + sân thượng. Nhà mới full nội thất dọn vào ở ngay. - Hẻm trước nhà 3m thông sạch sẻ, thoáng mát, an ninh, yên tĩnh,.. - Nhà hướng Tây Bắc - Bán: 5 tỷ 400 triệu (còn TL) LH: 0909284886 Tuấn Thành - xem nhà.	40	3	nan	3	nan	nan	5 tỷ 400 triệu
27	01/11/2022	Tin Thường	81143	Bán gấp lô đất Vạn Kiếp, Bình Thạnh, 4.5x26, GPXD 7 tầng, giá chỉ 80tr/m2	Bình Thạnh , Hồ Chí Minh	Vạn Kiếp, Bình Thạnh	+ Vị trí cực đẹp, giáp ngay khu Phan Xích Long sầm uất, vài bước qua quận 1 + Diện tích 4.5x26 cực đẹp + Xung quanh là Phan Đăng Lưu, Bạch Đằng, Đinh Tiên Hoàng, bệnh viện ND Gia Định, Ung Bướu, chợ Bà Chiểu + Pháp lý sạch sẽ, GPXD 1 hầm, 1 trệt, 4 lầu, sân thượng + LH: Khai Tâm 0903464105 để xem và gặp chính chủ thương lượng.	120	nan	nan	nan	nan	nan	9 tỷ 700 triệu
