	Date	Type	ID	Title	Location1	Location2	Description	Area	Bedrooms	Legal	WC	House orientation	Furniture	Price
106	22/11/2022	Tin Thường	83964	60m2 - Bán nhà mặt tiền 3 tầng- Lã Xuân Oai - Tăng Nhơn Phú A - Quận 9	Quận 9 , Hồ Chí Minh	đường Lã Xuân Oai, phường Tăng Nhơn Phú A, quận 9, thành phố Hồ Chí Minh	60m2 - Bán nhà mặt tiền 3 tầng- Lã Xuân Oai - Tăng Nhơn Phú A - Quận 9 60m2 - Bán nhà mặt tiền 3 tầng - ngang 4m5 dài 13 - chỉ 4 tỷ 7 Xe hơi đỗ cửa - Lã Xuân Oai - Tăng Nhơn Phú A - Quận 9 ✅ Diện tích: 60m2 (4.5m x 13.2m). ✅ Kết cấu nhà mới 1 trệt, 2 lầu đẹp không tì vết, bao gồm 3 phòng ngủ, 3WC, phòng khách, bếp. ✅ Đường nhựa trước nhà, thẳng một trục thông ra đường Lã Xuân Oai, sạch sẽ, khu an ninh, yên tĩnh, toàn biệt thự nhà cao tầng. ✅ Vị trí cực đẹp, chưa tới 1 phút ra chợ Tăng Nhơn Phú A, Lã Xuân Oai, Lê Văn Việt, Ngã Tư Thủ Đức thuận tiện di chuyển ra trung tâm thành phố Thủ Đức, đi đâu cũng tiện. ✅ Cạnh bên là trường Tiểu Học, THPT, Bệnh viện quận 9, Lê Văn Việt, Trung Tâm Thể Thao. ✅ Pháp lý sạch, công chứng ngay. ✅ ☎️☎️ Ms Giang 036 300 1478	60	2	nan	2	nan	nan	4 tỷ 700 triệu
107	21/09/2023	Tin Thường	108539	Nhà Đẹp Đường Nhựa Xe Hơi 6m Khu Lê Văn Quới, Bình Tân, 5 Tầng, Chỉ 5 Tỷ 7	Bình Tân , Hồ Chí Minh	Thành phố Hồ Chí Minh	- Nhà mới ở ngay, khu phân lô đồng bộ, nhà cao tầng liền kề, vị trí trung tâm, xung quanh đầy đủ tiện ích - Lê Văn Quới, Mã Lò, Tân Kỳ Tân Quý, Hương Lộ 2, Bình Trị Đông - Liên Hệ Xem Nhà Và Tư Vấn Miễn Phí: Phương Toàn - 0779926460	52	6	nan	6	nan	nan	5 tỷ 700 triệu
108	16/11/2022	Tin Thường	83196	Bán nhà Lạc Long Quân, Tân Bình 55m2, 4 tầng BTCT 6.4 tỷ - 0977943598	Tân Bình , Hồ Chí Minh	Mức giá	Bán nhà Lạc Long Quân, Tân Bình 55m2, 4 tầng BTCT 6.4 tỷ - 0977943598 ???? KHU VIP TÂN BÌNH - SÁT MẶT TIỀN - 55M2 - 4 TẦNG - 4 PN - SỔ VUÔNG VỨC ???? Mô tả: + Diện tích công nhận đủ: 55m2 + Vị trí đẹp, cách 1 căn ra mặt tiền. Gần khu Vip Bàu Cát, Đồng Đen, Phạm Phú Thứ, Ni Sư Huỳnh Liên,… + Thuận tiện di chuyển sang Quận 10, Quận Tân Phú, cách sân bay 15p đi xe, siêu thị, chợ Bàu Cát, chung cư Bàu Cát, trường học các cấp,… + Kết cấu: 1 trệt 2 lầu, sân thượng + Gồm: Phòng khách, bếp, 4 PN, 5 vệ sinh, mỗi phòng đều có nhà vệ sinh riêng biệt, có sân thượng trồng cây. + Sổ vuông vức, hoàn công đầy đủ. Giá bán: 6.4 tỷ thương lượng. Liên hệ xem nhà: Giang Nguyễn, SDT: 0977943598.	55	nan	nan	nan	nan	nan	6 tỷ 400 triệu
109	14/11/2022	Tin Thường	82940	Cần bán căn hộ Flora Fuji, 65m2 2PN 2WC, nội thất cơ bản, giá chỉ 2 tỷ 350 TL, LH: 0388668882	Quận 9 , Hồ Chí Minh	Đường D1, phường Phước Long B, Q9	Cần bán gấp căn hộ Flora Fuji Diện tích: 65m2 2PN - 2WC Nội thất: nội thất cơ bản Tiện ích: Hồ Bơi, gym, khu vui chơi, đường chạy bộ, siêu thị........ Giá bán: 2 tỷ 350 Thương lượng Địa chỉ: Đường D1, Phường Phú Hữu, Q9 Lh: 0388668882 gặp Tâm ( zalo )	65	2	nan	2	nan	nan	2 tỷ 350 triệu
110	07/11/2022	Tin Thường	82172	ĐẸP NHẤT LIÊN KHU 5-6 BÌNH TÂN - 61m2 - HẼM XE TẢI CHỈ 4,6 TỶ	Bình Tân , Hồ Chí Minh	Mức giá	+ Nhà 1 trệt 1 lầu 3PN mỗi tầng 1 nhà vệ sinh, sân thượng phía trước. Nhà chủ xây để ở nên rất tâm huyết, thoáng mát. + Hẻm thông xe tải tránh nhau xe tải vào nhà, cách mặt tiền 50m. + Sổ đẹp vuông vức, hỗ trợ công chứng ngay.	61	3	nan	nan	nan	nan	4 tỷ 600 triệu
111	05/11/2022	Tin Thường	81916	HXH Kinh doanh Vườn Lài Tân Phú 58m2, 4 tầng chỉ hơn 4 tỷ, Tặng Full Nội Thất.	Tân Phú , Hồ Chí Minh	Mức giá	+ Nhà cực mới, khách mua chỉ dọn vào ở, tặng tất cả nội thất như hình. + Căn nhà rộng, gia đình đông thoải mái với diện tích 58m2, ngang 5m. + Chủ mới xây dựng nên nhà có độ mới rất cao với kết cấu 1 trệt 3 lầu đúc bê tông cốt thép kiên cố, thiết kế mượt mà với 5 phòng ngủ thoáng, sân thượng trồng nhiều cây xanh mát là nơi thích hợp đề nghỉ ngơi, vui chơi thư giãn bên gia đình. + Vị trí đỉnh trung tâm Tân Phú, ngay sát các trục đường lớn nhất Tân Phú như Lũy Bán Bích, Vườn Lài, Âu Cơ. Rất thuận tiện di chuyển qua các quận khác như Tân Bình, Bình Tân, Quận 10, Quận 11 chỉ mất vài phút chạy xe. + Là khu kinh doanh sầm uất, buôn bán tấp nập chỉ cách vài bước chân đi bộ đã đến Chợ, Bệnh Viện, Trung tâm mua sắm AEON Mall Tân Phú, Siêu thị, Cửa hàng tiện lợi,... + Dân trí toàn học thức cao, tập trung nhiều nhà cao tầng, khu đang phát triển nhộn nhịp nhất Tân Phú. + Sổ hồng riêng, pháp lí chuẩn, công chứng ngay. * Giá 4,2 tỷ ( Thương Lượng ). Liên hệ ngay để xem nhà : KIỀU TRANG ( Sđt / Zalo 0898403842).	58	nan	nan	nan	nan	nan	4 tỷ 200 triệu
112	30/10/2022	Tin Thường	80892	Nhà 3 tầng ở ngay - Hẻm xe hơi thông - Vừa ở vừa kinh doanh - Nhỉnh 10 tỷ	Tân Bình , Hồ Chí Minh	Lạc Long Quân, Phường 10, Tân Bình, TPHCM	+ Lạc Long Quân, Phường 10, Tân Bình. + Diện tích: 58m2 (3.6 x 16) + Kết cấu 1 trệt 2 lầu, 4PN, 4WC, 1 phòng thờ, có sân để xe máy rộng, giếng trời mát mẻ cả ngày. Nhà mới đẹp, dọn vali vào ở ngay. + Hẻm xe hơi né nhau thoải mái. Thông tứ tung. + Vị trí quá thuận tiện để vừa ở vừa kinh doanh. Di chuyển về trung tâm quá gần. + Sổ vuông đẹp, không lỗi phong thủy. + Giá: 10.5 tỷ (thương lượng). + Liên hệ Mr Nhân 0779988718 (Zalo) xem nhà trực tiếp. * Nhận tìm nhà theo nhu cầu khách hàng. Hoàn toàn miễn phí, uy tín, tận tâm.	58	4	nan	4	Nam	nan	10 tỷ 500 triệu
113	28/10/2023	Tin Thường	111867	XÔ VIẾT NGHỆ TĨNH, PHƯỜNG 17, BÌNH THẠNH, 4 TẦNG BTCT, 70M2, 7.x TỶ	Bình Thạnh , Hồ Chí Minh	Mức giá	- Diện tích: 4.1 x 17m - Kết cấu: 1 trệt 2 lầu 1 sân thượng BTCT; 5 PN, 4 WC. Giếng trời, ban công mát mẻ - Đường đi sạch đẹp, an ninh, yên tĩnh. Khu vực Xô Viết Nghệ Tĩnh, Nguyễn Cửu Vân - Gần chợ Thị Nghè, Thảo Cầm Viên, CA phường, giáp ranh quận 1; tiện ích bao la - Sổ hồng chính chủ, hoàn công đủ, pháp lý chuẩn, công chứng mua bán ngay	70	5	nan	4	nan	nan	7 tỷ 400 triệu
114	19/10/2023	Tin Thường	111099	Bán đất kdc An Sương quận 12, sổ hồng riêng từng nền mua sang tên công chứng trong ngày	Quận 12 , Hồ Chí Minh	Mức giá	Khu dân cư An Sương quận 12- tphcm Chỉ còn sót lại 1 lô duy nhất góc 2 mặt tiền trải nhựa 12m , 16m quá đẹp -Dân cư đông đúc , xây dựng ở liền, tiện ích đầy đủ -Thích hợp xây nhà ở thoáng mát hoặc đầu tư 6-9 tháng x2x3 là bình thường -Diện tích 5x20=92m2 ( bo góc) . -Giá 2tỷ499 -Thổ cư 100% ️ 0703539556 để được sở hữu ngay em này Giá	100	nan	nan	nan	nan	nan	2 tỷ 500 triệu
115	13/10/2023	Tin Thường	110587	BÁN GẤP NHÀ 1TRỆT + 1 LẦU.ĐG BÌNH CHIỂU.PHƯỜNG BÌNH CHIỂU.TP-THỦ ĐỨC	Thủ Đức , Hồ Chí Minh	Hẻm đường Bình Chiểu Phường Bình Chiểu TP.Thủ Đức	Cần bán gấp Hiện trạng - Nhà 1 trệt 1 lầu.mới cứng.dọn vào ở ngay Diện tích. 4 X 14. Vuông vức. 54m2 Hẻm 6m rộng rãi sạch sẽ.ô tô ngủ trong nhà Vị trí nhà.ngay gần trạm y tế phường bình chiểu.cầu vượt gò dưa.KCN sóng thần.quân đoàn 4... Sổ hồng riêng.hoàn công đủ Lhe Em Hiếu 24/7 xem nhà + sổ.49X41. Giá 4.6ty. TL	54	2	nan	3	nan	nan	4 tỷ 600 triệu
116	10/10/2023	Tin Thường	110075	BÁN GẤP.NHÀ 3 TẦNG - ĐÚC BTCT - CHỈ 4tỷ. PHƯỜNG BÌNH CHIỂU - TP.THỦ ĐỨC	Thủ Đức , Hồ Chí Minh	Đường Bình Chiểu - Phường Bình Chiểu - TP.Thủ Đức	Tròn 4ty. Có ngay nhà 3 tầng. Bán nhà gần trạm y tế Phường Bình Chiểu TP.Thủ Đức 50m ra đường bình chiểu Nhà 1 trệt 2 lầu. Ngang 4.5m Nhà mới cứng - vào ở ngay Hẻm ô tô.thông thoáng sạch sẽ Sổ hồng riêng - hoàn công đủ Lhe Em Hiếu 24/7. Xem nhà + sổ	43	3	nan	3	nan	nan	4 tỷ
117	28/09/2023	Tin Thường	109051	Nhà hiếm, Trung Tâm Quân 10, Đường 3/2, 3 Tầng, Chỉ 3.95 Tỷ (TL).	Quận 10 , Hồ Chí Minh	Đường 3/2, Phường 10, Quận 10, TP. HCM	✅ Khu vực an ninh, Trung tâm Quận 10 – 3 Tháng 2 – Điện Biên Phủ - Lê Hồng Phong, Sầm uất, Dân trí cao, Tiện ích xung quang đủ thứ, Thuận tiện đi Quận 1, Quận 3, Quận 5, Quận 11, Quận Tân Bình, Bến xe Miền Đông, Miền Tây, Sân Bay… ✅ Gần Bệnh Viện Nhi Đồng, Siêu thị Vạn Hạnh Mall, Siêu Thị Sài Gòn, Big C, Bệnh Viện 115, Ngân hàng, Trường học các cấp, Hồ Kỳ Hòa, Nhà hát Hòa Bình… ✅ Kết cấu BTCT: 1 trệt, 2 lầu, 2PN, 3 WC, nhà cao cửa rộng, vào ở ngay, Lô góc 2 mặt hẻm thoáng mát., không bị ngập nước. ✅ Sổ hồng vuông vức, hoàn công đầy đủ, pháp lý chuẩn, không lộ giới, không quy hoạch, công chứng mua bán ngay. ☎️ Liên hệ Mr.Thủy 0908577929 ngay để được hỗ trợ.	26	2	nan	3	nan	nan	3 tỷ 950 triệu
118	03/05/2023	Tin Thường	95996	Bán nhà trọ HXH thông đường HƯƠNG LỘ 2, DT: 10.5x44.5m, 1 lầu, giá: 26 tỷ TL Liên Hệ Ngay	Bình Tân , Hồ Chí Minh	Mức giá	- Bán nhà trọ: Hẻm xe hơi thông đường Hương Lộ 2, DT: 10.5x44.5m. - Tiện ích: hẻm 7m thông ra đường Ao Đôi, cách mặt tiền đường chỉ 100m. Bán kính tiện ích nằm trong 1km như chợ, siêu thị, trường học, cửa hàng công nghệ, dịch vụ ăn uống,v.v... - Kết cấu: 1 trệt, 1 lầu, 19 phòng đang cho thuê. - Vị trí: Khu dân cư an ninh, dân trí cao, văn minh, sạch sẽ. - Giá: 26 tỷ TL. Liên hệ: 0707725457 Phú Cường. Hỗ Trợ Khách Hàng Đăng Bộ Sang Tên Hoàn Toàn Miễn Phí. Cam kết những thông tin trên đúng 100% sự thật. Uy Tín - Chuyên Nghiệp - Tốc Độ - Hiệu Quả. Sàn giao dịch BĐS TanPhuLand. Đc: 229 Lê Văn Quới, P. Bình Trị Đông, Q. Bình Tân, TP. HCM.	468	nan	nan	nan	nan	nan	26 tỷ
0	03/12/2022	Tin Thường	85231	Nhà rộng ô tô đỗ cửa. Gần Toyota Lê Trọng Tấn chỉ 4.45 tỷ	Tân Phú , Hồ Chí Minh	Tân Kỳ Tân Quý, Tân Quý, Tân Phú	Nhà mới xây, kết cấu 2 tầng. Gồm 2 phòng ngủ chính, 3WC. Nhà mới đep ở ngay, gia đình xây ở nên rất chắc chắn, móng ép cọc để xây lên thêm 3 tầng nữa. Đường nhựa ô tô tránh, vào nhà hay đậu cửa thoải mái. Vị trí ngay đối diện trung tâm thương mại AEON Tân Phú, tiện ích xung quanh không thiếu thứ gì, đi vào các Quận trung tâm rất thuận tiện. Nhà tiện ở vừa kinh doanh, làm văn phòng Cty, phòng mạch, Spa,.. Pháp lý chuẩn, sổ vuông vức. Liên hệ anh Võ: 0905 07 72 80. Không tiếp trung gian.	62	2	nan	3	nan	nan	7 triệu 100 nghìn
1	09/06/2023	Tin Thường	98799	Cần bán gấp nhà 1 trệt 2 lầu mới xây, 54m2 4PN - 3WC, sổ hồng hoàn công, giá 4 tỷ 9, TL mạnh	Quận 9 , Hồ Chí Minh	hẻm 230, Lò lu, Phường Trường Thạnh, Q9	Bán căn nhà phố 1 trệt 2 lầu vừa xây mới tại hẻm 230 Lò Lu, P. Trường Thạnh Quận 9. Nhà có Vị trí gần Vinhomes Q9, ĐH FPT, Samsung, Khu Công Nghệ Cao. Nhà DT Đất 54m² (4x13.7m). Thiết kế: 4PN - 3WC, sân trước, sân sau thoáng. Sổ Hồng riêng, hoàn công đầy đủ. Đường nhựa 6m, xe ôtô đổ trong nhà, Dân cư dân trí cao. Nhà thiết kế hiện đại, đẹp và rất thoáng mát. Giá bán 4,9 tỷ thương lượng mạnh. Nhà hướng Tây Tứ Trạch. LH 0388 668 882 gặp Tâm (zalo).	54	4	nan	3	nan	nan	4 tỷ 900 triệu
2	25/09/2023	Tin Thường	108783	CHO THUÊ MB NGUYỄN TRÃI QUẬN 1 - LẦU 1, 2, 3 - KHU MUA SẮM THỜI TRANG	Quận 1 , Hồ Chí Minh	105 Nguyễn Trãi Bến Thành , Quận 1	Cho thuê lại lầu 1 ,2 và lầu 3, trung tâm mua sắm thời trang. - Lầu đẹp đã sửa sang sạch sẽ - phù hợp kinh doanh thời trang . Lối đi chung. Xe để vỉa hè. Phù hợp với mặt hàng kinh doanh thời trang - giày dép . Giá thuê lầu 1: 35 triệu/tháng ( có 2 phòng thử đồ ) Giá thuê lầu 2: 20 triệu/tháng ( có nhà vs) Giá thuê lầu 3: 10 triệu/tháng ( có nhà vs ) Địa Chỉ : 105 Nguyễn Trãi , Bến Thành , Quận 1 ĐT : 0888912016 - Chị Vân	150	nan	nan	nan	nan	nan	35 triệu/tháng
3	15/09/2023	Tin Thường	108015	NHÀ SÁT MẶT TIỀN BẠCH ĐẰNG, PHƯỜNG 15, BÌNH THẠNH, 2 TẦNG BTCT, 40M2, 4.x TỶ	Bình Thạnh , Hồ Chí Minh	Mức giá	- Kết cấu nhà: 1 trệt 2 lầu BTCT, 3 PN, 2 WC; phòng khách, bếp đầy đủ công năng. Nhà bao chắc chắn, khách mua xách vali vào ở luôn - Nhà đang có dòng tiền 15tr/tháng, mua là có ngay thu nhập tốt - Khu vực sầm uất, gần ngã tư Hàng Xanh. Nhà cách mặt tiền Bạch Đằng chỉ 20m; đường đi thông khắp nơi, sạch sẽ, an ninh, yên tĩnh. Xung quanh là các đường lớn như Điện Biên Phủ, Xô Viết Nghệ Tĩnh, Đinh Bộ Lĩnh, Lê Văn Duyệt; đi đâu cũng gần cũng tiện cũng nhanh - Gần chợ Bà Chiểu, BV Bình Thạnh, UBND quận, Công an phường, ĐH Hutech, chỉ 5 phút chạy xe là sang quận 1; khu vực ngập tràn tiện ích - Sổ hồng chính chủ, hoàn công đủ, pháp lý chuẩn, công chứng mua bán trong ngày	40	3	nan	2	nan	nan	Số toilet
4	09/09/2023	Tin Thường	107503	Hxh 3pn 5x10 Nơ Trang Long P13 Bình Thạnh 4,9 tỷ	Bình Thạnh , Hồ Chí Minh	Mức giá	3pn Hxh 5x10 Nơ Trang Long P13 Bình Thạnh 4,9 tỷ + Hẻm thông oto tận nhà, gần tiện mặt tiền, 3 phòng ngủ + 4WC. + An ninh, dân trí, tiện ích bến xe miền đông, Vincom. + Phạm Văn Đồng, Chu Văn An, hàng xanh	50	3	nan	4	nan	nan	4 tỷ 900 triệu
5	10/07/2023	Tin Thường	101615	Nhà mới đẹp ở ngay Đường số 59 Phường 14 Gò Vấp 73m2 4 tầng chỉ 5.3 tỷ	Gò Vấp , Hồ Chí Minh	Đường Số 59	MS 17823 * Vị trí: ngay chợ Thạch Đà nên không lo thiếu bất cứ thứ gì. * Diện tích 73 m2, ngang 4m dài 18m. Kết cấu: Nhà 1 trệt 1 lửng 2 lầu, 3 phòng ngủ, phòng thờ, phía sau nhà có khoảng sân rộng trồng cây cảnh, phơi đồ... * Đường trước nhà 4m, sạch sẽ rộng thoáng. * Sổ hồng, hoàn công đầy đủ.	73	3	nan	nan	nan	nan	5 tỷ 300 triệu
6	19/06/2023	Tin Thường	99823	Bán nhà HXH đường HƯƠNG LỘ 2, DT: 4x19m, giá: 5.3 tỷ TL Liên Hệ Ngay	Bình Tân , Hồ Chí Minh	Mức giá	- Bán nhà: hẻm xe hơi đường Hương Lộ 2, DT: 4x19m. - Hiện trạng: Hẻm trước nhà 6m xe hơi vô đến nhà, cách mặt tiền đường chỉ vài chục m, cách ngã 4 Hương Lộ 2 - Mã Lò chưa đến 500m. Bán kính tiện ích nằm trong 1km như chợ, siêu thị, trường học các cấp, bệnh viện, cửa hàng công nghệ, dịch vụ ăn uống,v.v... - Kết cấu: Nhà cấp 4, tiện xây mới. - Vị trí: Khu dân cư an ninh, dân trí cao, văn minh, sạch sẽ. - Giá: 5.3 tỷ TL. Liên hệ: 0707725457 Phú Cường. Hỗ Trợ Khách Hàng Đăng Bộ Sang Tên Hoàn Toàn Miễn Phí. Cam kết những thông tin trên đúng 100% sự thật. Uy Tín - Chuyên Nghiệp - Tốc Độ - Hiệu Quả. Sàn giao dịch BĐS TanPhuLand. Đc: 229 Lê Văn Quới, P. Bình Trị Đông, Q. Bình Tân, TP. HCM.	76	nan	nan	nan	nan	nan	5 tỷ 300 triệu
7	01/06/2023	Tin Thường	98287	Nhà 3 tầng đầu đường Ni Sư Huỳnh Liên, thông Bàu Cát. 2.85 tỷ	Tân Bình , Hồ Chí Minh	Ni Sư Huỳnh Liên, P.10, Tân Bình	Nhà gia đình xây ở, đúc kiên cố chắc chắn 1 trệt 2 lầu đầy đủ công năng, cách mặt tiền chỉ 1 căn, nhà gồm 2 phòng ngủ. Vị trí thông đường Hồng Lạc, cạnh Vinmart Bàu Cát. Tiện ích: chợ, siêu thị, trường học,.. Sổ hồng riêng, pháp lý chuẩn. Liên hệ anh Võ: 0909 100 817. Không tiếp trung gian.	27	2	nan	2	nan	nan	2 tỷ 850 triệu
8	18/12/2022	Tin Thường	86767	HXH Đinh Tiên Hoàng 5,9x19 4 lầu P3 Bình Thạnh	Bình Thạnh , Hồ Chí Minh	Mức giá	8,8 tỷ đinh tiên hoàng 5,9x19 HXH 4 lầu P3 Bình Thạnh. + Nhà đẹp,kiên cố nở hậu tài lộc cả năm + Ngang bề thế vị trí đắc địa, oto quay đầu Nơ Trang Long, Bạch Đằng, Lê Quang Định, Điện Biên Phủ, XVNT..8,8 tỷ + 5pn, 5wc khách, bếp siêu rộng, sân thượng + ĐH Hutech, Hồng Bàng, hàng xanh, Phan Xích Long chỉ 500m	112	5	nan	5	nan	nan	8 tỷ 800 triệu
9	26/05/2023	Tin Thường	97775	Vợ Chồng em cần nhượng lại lô đất tại P. Long Thạnh Mỹ, TP Thủ Đức, DT 108m, giá 2,3 tỷ	Quận 9 , Hồ Chí Minh	Mức giá	Vị trí lô đất cực đẹp mặt tiền Hoàng Hữu Nam trung tâm Quận 9 Gần Bến Xe Miền Đông mới Bệnh Viện Ung Bướu, Khu Công Nghệ Cao Sát bên điện máy xanh cực kỳ tiềm năng, tiện kinh doanh mọi ngành nghề. Thuận lợi cho việc mở Văn Phòng Công ty, KD nhà hàng, khách sạn, showroom Sổ hồng riêng và đất thổ cư 100% sang tên công chứng trong ngày Hỗ trợ giấy phép xây dựng và hoàn công Không tiếp nhận môi giới	108	nan	nan	nan	nan	nan	2 tỷ 300 triệu
10	03/05/2023	Tin Thường	95983	Vị Trí Cực Đẹp . Nhà Đẹp Cực Hiếm - Căn Góc 2 Mặt Đường - Thoáng .	Gò Vấp , Hồ Chí Minh	MT 93 , Đường số 1	- MT 93 , Đường số 1 , P4 , Quận Gò Vấp . - Ngay Nguyễn Thái Sơn & Phạm Ngũ Lão . - Sát Emart , Chợ Gò Vấp , ĐH CN4 ... - 4m8 x7m5 . Công nhận đủ 35m2 . - BTCT kết cấu : Trệt , 1 lầu , sân thượng . - 2 PN , 2 WC . - Thiết kế mở Spa , Nail , Hair Salon hoặc Shop Online . - Full nội thất , Camera , Khoá cửa vân tay 2 cửa cổng . - Bán : 4 tỷ 3 tl . - Xem nhà báo trước 30 phút để xem trong . - Thiện chí xin điện thoại hoặc Zalo để được tư vấn đàm phán với chủ nhà có giá tốt nhất . CT Tư Vấn Thiết Kế & Giám Sát XD Bình Gia Phú hỗ trợ các đội thi công . Liên hệ : BĐS Khoa - 0932174926 . Nhận Ký Gửi nhà chính chủ các Quận trong Thành Phố .	35	2	nan	2	nan	nan	4 tỷ 300 triệu
11	16/04/2023	Tin Thường	94959	Nhà dưới 4 tỷ Lê Văn Thọ, phường 8 Gò Vấp, 34m2, 2 tầng chỉ 3.4 tỷ	Gò Vấp , Hồ Chí Minh	Lê Văn Thọ	MS 7423 * Vị trí: hẻm 1 sẹc đường Lê Văn Thọ, phường 8, Gò Vấp, gần công viên Làng Hoa, 100m ra mặt tiền Lê Văn Thọ. * Nhà mới, vào ở ngay. Diện tích 34m2, 3m x 11m, 1 trệt 1 lầu gồm 2 phòng ngủ, 2 WC. * Đường trước nhà 3m, an ninh, yên tĩnh. * Xung quanh đầy đủ tiện ích: gần chợ, trường học, siêu thị.	34	2	nan	2	nan	nan	3 tỷ 400 triệu
12	30/03/2023	Tin Thường	93679	Nhà mặt tiền đường nhựa 8 mét - Thông Song Hành - Thị Trấn Hốc Môn - 85m2 chỉ 4 tỷ 7.	Hóc Môn , Hồ Chí Minh	Song Hành - Hốc Môn	Nhà 85m2 - Vị trí tuyệt đẹp, mặt tiền đường 8 mét, thông Song Hành - Lý Thường Kiệt. - Ngang chuẩn đẹp 6.5 mét. - Kết cấu 2 tầng BTCT, có gara để ô tô, 3PN, có phòng tầng trệt. - Nhà phù hợp vừa ở vừa mở cửa hàng kinh doanh. - Sổ hồng riêng, vuông đẹp, mua bán công chứng ngay. - 0974642828 - Gặp Tươi xem nhà, xem sổ.	85	3	nan	3	nan	nan	4 tỷ 700 triệu
13	03/03/2023	Tin Thường	91375	Khu Dân Cư Cao Cấp - 39/15/1B . Huỳnh Bật Đạt - P15 Quận Tân Bình .	Tân Bình , Hồ Chí Minh	39/15/1B . Huỳnh Bật Đạt - P15 Quận Tân Bình .	- Hẻm xe hơi & Dân trí . - Vị trí đẹp - Nhà cao cửa rộng . - Diện tích : 4m7 x 9m3 . Công nhận 39m2 . - Trệt , lững , 3 lầu , sân thượng . - Nhà đang cho thuê . - Sổ hồng chính chủ - Hoàn công đủ 6 sàn . - Bán 5 tỷ 850 tl . - Xem nhà báo trước 30 phút để xem trong. - Thiện chí xin điện thoại hoặc Zalo để được tư vấn đàm phán với chủ nhà có giá tốt nhất. CT Tư Vấn Thiết Kế & Giám Sát XD Bình Gia Phú hỗ trợ các đội thi công. Liên hệ : BĐS Khoa - 0906336608. Nhận Ký Gửi nhà chính chủ các Quận trong Thành Phố .	39	4	nan	4	nan	nan	5 tỷ 850 triệu
14	01/03/2023	Tin Thường	91119	NHÀ HXH TRẦN XUÂN SOẠN Q7 NGANG 5M CÓ SẴN NGUỒN THU 25TR/THÁNG	Quận 7 , Hồ Chí Minh	TRẦN XUÂN SOẠN, Q7	- Diện tích: 5x30m - Hiện tại đang cho thuê phòng trọ thu nhập 25 triệu/tháng - Cách mặt tiền đường 200m. Gần trường ,gần chợ ,ủy ban, công an, siêu thị bán kính 500 m là có đủ Anh chị xem nhà liên hệ Tuấn Xin miễn tiếp môi giới và quảng cáo	150	nan	nan	nan	nan	nan	10 tỷ 400 triệu
15	28/02/2023	Tin Thường	90863	Bán nhà HXH thông đường SỐ 3 BÌNH LONG, DT: 4x14.5m, 1 lầu, giá: 4 tỷ TL Liên Hệ Ngay	Bình Tân , Hồ Chí Minh	Mức giá	- Bán nhà: Hẻm xe hơi thông đường Số 3 Bình Long, DT: 4x16.5m. - Tiện ích: Hẻm 6m thông ra đường Bình Long, cách ngã 3 Bình Long - Nguyễn Sơn (Tân Phú) chỉ 200m. Bán kính tiện ích nằm trong 1km như chợ, siêu thị, trường học, cửa hàng công nghệ, dịch vụ ăn uống,v.v... - Kết cấu: 1 trệt, 1 lầu. - Vị trí: Khu dân cư an ninh, dân trí cao, văn minh, sạch sẽ. - Giá: 4 tỷ TL. Liên hệ: 0707725457 Phú Cường. Hỗ Trợ Khách Hàng Đăng Bộ Sang Tên Hoàn Toàn Miễn Phí. Cam kết những thông tin trên đúng 100% sự thật. Uy Tín - Chuyên Nghiệp - Tốc Độ - Hiệu Quả. Sàn giao dịch BĐS TanPhuLand. Đc: 229 Lê Văn Quới, P. Bình Trị Đông, Q. Bình Tân, TP. HCM.	66	nan	nan	nan	nan	nan	4 tỷ
16	15/02/2023	Tin Thường	89839	Gấp bán nhà Hẻm xe hơi LT-60 m2-Tân Chánh Hiệp-Quận 12-Chỉ nhỉnh 3 tỷ.	Quận 12 , Hồ Chí Minh	Tân Chánh Hiệp - Quận 12 - Tp Hồ Chí Minh	TÂN CHÁNH HIỆP - QUẬN 12. - Nhà 60 m2 , nhà rất mới ở ngay. - Sổ hồng riêng , nở hậu . - Khu yên tĩnh , 10 mét ra mặt tiền. - Gần ngã tư Tô Ký , gần trường ĐHGT Vận Tải ... - Xung quanh đủ chợ, trường học, ngân hàng. - Sổ hồng riêng, mua bán công chứng ngay. - 0974642818 gặp Tươi xem nhà, xem sổ.	60	1	nan	1	nan	nan	3 tỷ 300 triệu
17	11/02/2023	Tin Thường	89583	96m2 hẻm xe hơi, giá mềm 5,9 tỷ, khu vuc an ninh, ở tốt	Quận 8 , Hồ Chí Minh	Phạm Thế Hiển P6Q8	- Diện tích: 96.3m2 công nhận đủ, nhà hơi cũ tiện sửa hoặc xây mới. - Kết cấu: Nhà 1 trệt, 1 lửng đúc, 4 phòng ngủ, 4 WC. Chủ từng cho người quen thuê 10tr/th, nay lấy lại để bán lo việc riêng. - Vị trí: Ngay Cầu Nhị Thiên Đường, gần chợ Lò Than, trường học, ủy ban,... Khu dân trí cao. Thuận tiện đi lại các quận trung tâm, cách bến xe quận 8 vài phút, UBND Quận 1km...tiện ích xung quanh. - Sổ hồng riêng - nở hậu, hoàn công đầy đủ.	96	3	nan	3	nan	nan	5 tỷ 900 triệu
18	15/01/2023	Tin Thường	88559	Hxh 3 lầu 6x16 Nguyễn Thái Sơn P4 Gò Vấp	Gò Vấp , Hồ Chí Minh	Mức giá	Ô TÔ VÀO NHÀ - NGANG KHỦNG GIÁ RẺ GẦN SÂN BAY, LÊ QUANG ĐỊNH... 6x16 Hxh 3 lầu Nguyễn Thái Sơn P4 Gò Vấp + Nhà đẹp chủ xây chắc chắn 1T 3L ST đúc BTCT có sân để ô tô 5pn,4wc... + Toàn cao tầng, thân thiện, dân trí cao, tiện ích đầy đủ, xây hết 3 tỷ bán 11,2 tỷ + Sổ riêng ngang khủng, pháp lý chuẩn	96	5	nan	4	nan	nan	11 tỷ 200 triệu
19	01/10/2023	Tin Thường	109295	✅ Chỉ 2.9 tỷ TL - Nhà Ở gia đình, ngang 4m, HXH - Tân Tạo Bình Tân, 40m2	Bình Tân , Hồ Chí Minh	Mức giá	+ Nhà xây chắc chắn để Ở - 1 trệt 1 lầu, 3PN, 2Wc + Hẻm lớn, an ninh, dân trí, tiện ích, không lộ giới + Sổ hồng riêng chính chủ, công chứng ngay. + Liên hệ Mr THIÊN PHƯỚC 086 7000 938 để hẹn lịch đến xem nhà sớm nhất N2-75	40	3	nan	2	nan	nan	2 tỷ 900 triệu
